{
  "schemaVersion": 1,
  "id": "T-0007",
  "recordVersion": 1,
  "taskRevision": 1,
  "outcome": "Add a shell script that packages the portable framework core as a zip archive",
  "authority": {
    "reference": "User instruction, 2026-07-14",
    "acceptedDate": "2026-07-14"
  },
  "status": "done",
  "dependencies": [
    "T-0006"
  ],
  "route": "quick_change",
  "risk": "high",
  "tags": [],
  "gate": {
    "kind": "none"
  },
  "nextSafeAction": null,
  "details": [
    {
      "label": "Brief",
      "path": "readme/tasks/0007-core-package-script-brief.md"
    },
    {
      "label": "notes",
      "path": "readme/tasks/0007-core-package-script-notes.md"
    }
  ],
  "completion": {
    "completedAt": null,
    "repositoryChanged": null,
    "evidence": "[Decision 0010](../decisions/0010-automate-portable-core-archive.md)"
  }
}
