{
  "schemaVersion": 1,
  "id": "T-0046",
  "recordVersion": 4,
  "taskRevision": 1,
  "outcome": "Implement the existing file engine as FileTaskStore behind the TaskStore port with behavioral parity, preserving it as the sole production and canonical backend while removing direct CLI dependence on file layouts and adding no backend selector, migration path, or dual-write behavior",
  "authority": {
    "reference": "User direction delivered 2026-08-13: capture the complete recommended implementation order as tasks",
    "acceptedDate": "2026-08-13"
  },
  "status": "done",
  "dependencies": [
    "T-0045"
  ],
  "route": "initiative",
  "risk": "high",
  "tags": [
    "framework",
    "task-store",
    "file-adapter",
    "architecture"
  ],
  "gate": {
    "kind": "none"
  },
  "nextSafeAction": null,
  "details": [],
  "completion": {
    "completedAt": "2026-08-13",
    "repositoryChanged": true,
    "evidence": "Implemented the existing engine as the sole implicit FileTaskStore production adapter and routed all CLI reads and semantic planner publications through it under one compatible lock. Independent QA PASS; FileTaskStore/architecture 10/10, framework-data 38/38 including 10k, packed task CLI 8/8, package matrix, 60-file reproducible audit, syntax, static layering/sole-backend, doctor, and diff checks passed."
  }
}
