{
  "schemaVersion": 1,
  "id": "T-0016",
  "recordVersion": 1,
  "taskRevision": 2,
  "outcome": "Reconcile imported meta-framework changes and establish the framework-changelog stub and boundary",
  "authority": {
    "reference": "User instructions, 2026-08-05",
    "acceptedDate": "2026-08-05"
  },
  "status": "done",
  "dependencies": [],
  "route": "initiative",
  "risk": "high",
  "tags": [],
  "gate": {
    "kind": "none"
  },
  "nextSafeAction": null,
  "details": [
    {
      "label": "Brief",
      "path": "readme/tasks/0016-imported-framework-reconciliation-brief.md"
    },
    {
      "label": "notes",
      "path": "readme/tasks/0016-imported-framework-reconciliation-notes.md"
    }
  ],
  "completion": {
    "completedAt": null,
    "repositoryChanged": null,
    "evidence": "[Decision 0017](../decisions/0017-ship-blank-framework-changelog-seed.md), [quality](../quality/2026-08-05-imported-framework-reconciliation.md)"
  }
}
