{
  "schemaVersion": 1,
  "id": "T-0018",
  "recordVersion": 1,
  "taskRevision": 1,
  "outcome": "Evaluate script-gated framework data stores and long-horizon process scalability",
  "authority": {
    "reference": "User instruction, 2026-08-11",
    "acceptedDate": "2026-08-11"
  },
  "status": "done",
  "dependencies": [],
  "route": "decide",
  "risk": "medium",
  "tags": [],
  "gate": {
    "kind": "none"
  },
  "nextSafeAction": null,
  "details": [
    {
      "label": "Notes",
      "path": "readme/tasks/0018-data-store-scalability-evaluation-notes.md"
    }
  ],
  "completion": {
    "completedAt": null,
    "repositoryChanged": null,
    "evidence": "[Assessment](0018-data-store-scalability-evaluation-notes.md#findings)"
  }
}
