{
  "schemaVersion": 1,
  "id": "T-0029",
  "recordVersion": 5,
  "taskRevision": 1,
  "outcome": "Provide thin Codex AGENTS.md and Claude CLAUDE.md bootstraps plus clean client initialization without copying reusable framework policy",
  "authority": {
    "reference": "User instruction, 2026-08-11 via umbrella T-0023",
    "acceptedDate": "2026-08-11"
  },
  "status": "done",
  "dependencies": [
    "T-0027"
  ],
  "route": "initiative",
  "risk": "high",
  "tags": [
    "harness",
    "onboarding"
  ],
  "gate": {
    "kind": "none"
  },
  "nextSafeAction": null,
  "details": [
    {
      "label": "Umbrella brief",
      "path": "readme/tasks/0023-npm-package-delivery-brief.md"
    }
  ],
  "completion": {
    "completedAt": "2026-08-11",
    "repositoryChanged": true,
    "evidence": "Thin Codex/Claude bootstraps and guarded Linux client initializer shipped; focused 13/13, task 36/36, prompt 8/8, package 55/55, full 88/88, exact 66-file package audit, warning-free unstaged doctor/diff, and independent Architect, Security, QA, Reviewer passes"
  }
}
