{
  "schemaVersion": 1,
  "id": "T-0050",
  "recordVersion": 2,
  "taskRevision": 2,
  "outcome": "Isolate the legacy Format 1 task-store importer behind onboarding, declare its supported compatibility window, sunset criteria, and removal conditions, and avoid expanding one-shot migration machinery after the structured store is established",
  "authority": {
    "reference": "User direction delivered 2026-08-13: capture all previously identified task-store simplification work as independently reviewable tasks",
    "acceptedDate": "2026-08-13"
  },
  "status": "pending",
  "dependencies": [
    "T-0049"
  ],
  "route": "quick_change",
  "risk": "medium",
  "tags": [
    "framework",
    "task-store",
    "migration",
    "compatibility"
  ],
  "gate": {
    "kind": "none"
  },
  "nextSafeAction": "Inventory the existing importer contract from current code and documentation, then specify the compatibility sunset and isolate invocation to onboarding without adding new legacy behaviors",
  "details": [],
  "completion": null
}
