{
  "schemaVersion": 1,
  "id": "T-0026",
  "recordVersion": 1,
  "taskRevision": 1,
  "outcome": "Expose the guarded task store through the installed package CLI while separating immutable package resources from mutable client-repository paths",
  "authority": {
    "reference": "User instruction, 2026-08-11 via umbrella T-0023",
    "acceptedDate": "2026-08-11"
  },
  "status": "pending",
  "dependencies": [
    "T-0024",
    "T-0025"
  ],
  "route": "initiative",
  "risk": "high",
  "tags": [
    "task-cli",
    "npm-package"
  ],
  "gate": {
    "kind": "none"
  },
  "nextSafeAction": "Refactor resource and project-root resolution, expose tasks doctor/startup and semantic mutations under the package binary, and preserve all existing safety and bounded-query tests",
  "details": [
    {
      "label": "Umbrella brief",
      "path": "readme/tasks/0023-npm-package-delivery-brief.md"
    }
  ],
  "completion": null
}
