{
  "schemaVersion": 1,
  "id": "T-0021",
  "recordVersion": 7,
  "taskRevision": 2,
  "outcome": "Add a guarded `project-onboarding` skill backed by the structured preflight",
  "authority": {
    "reference": "User instruction, 2026-08-11 via T-0019",
    "acceptedDate": "2026-08-11"
  },
  "status": "done",
  "dependencies": [
    "T-0020"
  ],
  "route": "initiative",
  "risk": "high",
  "tags": [],
  "gate": {
    "kind": "none"
  },
  "nextSafeAction": null,
  "details": [
    {
      "label": "Brief",
      "path": "readme/tasks/0021-project-onboarding-skill-brief.md"
    },
    {
      "label": "Execution notes",
      "path": "readme/tasks/0021-project-onboarding-skill-notes.md"
    },
    {
      "label": "Quality record",
      "path": "readme/quality/2026-08-11-project-onboarding-skill.md"
    },
    {
      "label": "Threat model",
      "path": "readme/threat-models/2026-08-11-project-onboarding-skill.md"
    }
  ],
  "completion": {
    "completedAt": "2026-08-11",
    "repositoryChanged": true,
    "evidence": "30 tests, both skill validators, deterministic 46-entry package SHA-256 4b77df022a622b85cb61b866af10b70ca163f954d464aac0d9f51eef6001f674, installer collision/failure/TERM matrix, and independent Reviewer/Security/QA passes"
  }
}
